Title,Frequency,Full Address,Publisher,Street Address,lat,lon,People,Category,ALPDEntry
Young Comrade,monthly,"Young Workers' League (Junior Sec tion), 1113 West Washington Boulevard, Chicago, Illinois",Young Workers' League (Junior Section),"1113 West Washington Boulevard, Chicago, Illinois",41.882769,-87.6549313637883,Max Schachtman,Communist,"Young Comrade, The (monthly). Established 1923, 8 pages, $.50, circulation 8,000. Young Workers' League (Junior Sec tion), 1113 West Washington Boulevard, Chicago, Ill. Max Schachtman. Uses mats."
Young Worker,weekly,"Young Workers' League of America (National Executive Committee), 1113 West Washington Boulevard, Chicago, Illinois",Young Workers' League of America (National Executive Committee),"1113 West Washington Boulevard, Chicago, Illinois",41.882769,-87.6549313637883,Max Schachtman,Communist,"Young Worker, The (weekly). Tuesdays. Established 1922, 4 pages, $1.50, circulation 7,000. Young Workers' League of America (National Executive Committee), 1113 West Washington Boulevard, Chicago, Ill. Max Schachtman. Federated Press, Young Communist International Press Service. Uses mats."
Peoples Voice,weekly,"Farmer-Labor Publishing Co., 712 Chicago Street, Green Bay, Wisconsin",Farmer-Labor Publishing Co.,"712 Chicago Street, Green Bay, Wisconsin",44.5067113673469,-88.0122410612245,F. H. Shoemaker,Farmer-Labor,"Peoples Voice, The (weekly). Thursdays. Established 1922, 8 and more pages, $3, circulation 3,720. Farmer-Labor Publishing Co., Inc., 712 Chicago Street, Green Bay, Wise. F. H. Shoemaker. Official organ, Federated Trades Council, Local, American Society of Equity, etc. International Labor News. Uses mats."
Journal of Political Economy,bimonthly,"Department of Political Economy, The University of Chicago, 5750 Ellis Avenue, Chicago, Illinois","Department of Political Economy, The University of Chicago","5750 Ellis Avenue, Chicago, Illinois",41.6580916,-87.5975093,NONE,Publications Concerned with Labor Questions,"Journal of Political Economy, The (bimonthly). Established 1892, 112 pages, $4, circulation 1,000. Department of Political Economy, The University of Chicago, 5750 Ellis Avenue, Chicago, Ill. Scientific publication."
Christian Century,weekly,"The Christian Century Press, 440 South Dearborn Street, Chicago, Illinois",The Christian Century Press,"440 South Dearborn Street, Chicago, Illinois",41.8763873786464,-87.6293600783074,"Charles Clayton Mor rison, Paul Hutchinson, man",Religious,"Christian Century, The (weekly). Thursdays. Established 1886, 32 pages, $4. The Christian Century Press, 440 South Dearborn Street, Chicago, Ill. Charles Clayton Mor rison., Paul Hutchinson, man. ed."
"Continent,",weekly,"The McCormick Publishing Company, 509 South Wabash Avenue, Chicago, Illinois, and 156 Fifth Avenue, New York, New York",The McCormick Publishing Company,"509 South Wabash Avenue, Chicago, Illinois",41.8755328573768,-87.6259131740156,Oliver R. Williamson,Religious,"Continent, The, (weekly). Thursdays. Established 1870, 24-68 pages, $3, circulation 19,533. The McCormick Publish ing Company, 509 South Wabash Avenue, Chicago, Ill., and 156 Fifth Avenue, New York, N. Y. Oliver R. Wil liamson, man. ed. Published in the interests of the Presbyterian Church."
Northwestern Christian Advocate,weekly,"The Methodist Book Concern, 740 Rush Street, Chicago, Illinois",The Methodist Book Concern,"740 Rush Street, Chicago, Illinois",41.8959808220177,-87.6255963247575,Dan B. Brummitt,Religious,"Northwestern Christian Advocate, The (weekly). Wednesdays. Established 1885, 24 pages, $2, circulation 36,000. The Methodist Book Concern, 740 Rush Street, Chicago, Ill. Dan B. Brummitt. Official organ, Methodist Episcopal Church."
Unity,weekly,"Unity Publishing Company, 700 Oakwood Boulevard, Chicago, Illinois",Unity Publishing Company,"700 Oakwood Boulevard, Chicago, Illinois",41.82295565,-87.6094659148558,"John Haynes Holmes, Francis Neilson",Religious,"Unity (weekly). Mondays. Established 1878, 16 pages, $3, circulation 1,500. Unity Publishing Co., 700 Oakwood Boulevard, Chicago, Ill. John Haynes Holmes, Francis Neilsons."
Labor Bulletin,monthly,"Illinois Department of Labor, 116 North Dearborn Street, Chicago, Illinois",Illinois Department of Labor,"116 North Dearborn Street, Chicago, Illinois",41.8836806461264,-87.6295429603367,R. D. Cahn,Governmental,"Labor Bulletin, The (monthly). Established 1921, 16 pages, cir culation 5,000. Illinois Department of Labor, 116 North Dearborn Street, Chicago, Illinois. R. D. Cahn."
Federation News,weekly,"Chicago Federation of Labor, 166 West Washington Street, Chicago, Ill. James Bruck",Chicago Federation of Labor,"166 West Washington Street, Chicago, Ill. ",41.88343865,-87.6330603500175,James Bruck,General Labor (U.S.),"Federation News, The (weekly). Saturdays. Established 1919, 12 pages, $2.50, circulation 15,000. Chicago Federation of Labor, 166 West Washington Street, Chicago, Ill. James Bruck, ed."
Illinois Labor News,monthly,"Illinois Labor News, Inc., 105 West Monroe Street, Chicago, Ill. C. E. Bowers",Illinois Labor News,"105 West Monroe Street, Chicago, Ill.",41.8806736,-87.6323131,C. E. Bowers,General Labor (U.S.),"Illinois Labor News (monthly). Established 1923, 4 pages, $1, circulation 16,000. Illinois Labor News, Inc., 105 West Monroe Street, Chicago, Ill. C. E. Bowers, ed. In ternational Labor News. Uses mats."
Illinois State Federation of Labor Weekly News Letttr,weekly,"Illinois State Federation of Labor, 166 West Washington St., Chicago, Ill. Victor A. Olander, John H. Walker, eds. American Federation of Labor Weekly News. Sent to all affiliated local unions and central bodies.",Illinois State Federation of Labor,"166 West Washington St., Chicago, Ill.",41.88343865,-87.6330603500175,"Victor A. Olander, John H. Walker",General Labor (U.S.),"Illinois State Federation of Labor Weekly News Letttr (weekly). Saturdays. Established 1915, 4-8 pages. Illinois State Federation of Labor, 166 West Washington St., Chicago, Ill. Victor A. Olander, John H. Walker, eds. American Federation of Labor Weekly News. Sent to all affiliated local unions and central bodies."
Prosveta,daily,"2657-9 South Lawndale Avenue, Chicago, Ill.Joseph Zavertnik, John Molek, Andrew Kobal, eds.","2657-9 South Lawndale Avenue, Chicago, IL","2657-9 South Lawndale Avenue, Chicago, IL",41.7678477,-87.7151448,"Joseph Zavertnik, John Molek, Andrew Kobal",General Labor (U.S.),"Prosveta (daily). Established 1907, 4-8 pages, $5, circulation 13,834 5 days and Wednesdays 44,843. Slavonic National Benefit Society, 2657-9 South Lawndale Avenue, Chicago, Ill. Joseph Zavertnik, John Molek, Andrew Kobal, eds. Sympathizes with unionism and Socialism."
Public Ownership,monthly,"Public Ownership League of America, 127 North Dearborn Street, Chicago, Ill.",Public Ownership League of America,"127 North Dearborn Street, Chicago, Ill.",41.8838743,-87.6294948,NONE,General Labor (U.S.),"Public Ownership (monthly). Public Ownership League of America, 127 North Dearborn Street, Chicago, Ill."
Rovnost Ludu,semi-weekly,"1510 West 18th Street, Chicago, Ill.","1510 West 18th Street, Chicago, IL","1510 West 18th Street, Chicago, Ill.",41.85799905,-87.6642809901599,NONE,General Labor (U.S.),"Rovnost Ludu (semi-weekly). Established 1907, 8 pages, $4. Slovak workers, publishers, 1510 West 18th Street, Chicago, Ill. Endorsed by sick benefit societies. Uses mats."
Union Labor Advocate,monthly,"George Hodge, pub. and ed., 107 N. Market Street, Chicago, Ill.",,"107 N. Market Street, Chicago, Ill.",[],,George Hodge,General Labor (U.S.),"Union Labor Advocate (monthly). Established 1900, $1.50. George Hodge, pub. and ed., 107 N. Market Street, Chicago, Ill."
Union Labor News,weekly,"American Labor Press, Inc., 160 North Wells Street, Chicago, Ill. Pete Cunniflf",American Labor Press,"160 North Wells Street, Chicago, Ill.",41.8844656,-87.6338983,Pete Cunniflf,General Labor (U.S.),"Union Labor News (weekly). Saturdays. Established 1916, 8 pages, $2, circulation 56,220. American Labor Press, Inc., 160 North Wells Street, Chicago, Ill. Pete Cun- niflf, ed. Official organ, several local jinions. Uses mats."
Union Leader,weekly,"Amalgamated Association of Street and Electric Railway Employes of America, 332 South Ashland Boulevard, Chicago, Ill. L. D. Bland",Amalgamated Association of Street and Electric Railway Employes of America,"332 South Ashland Boulevard, Chicago, Ill.",41.8788889,-87.6667174,L. D. Bland,General Labor (U.S.),"Union Leader, The (weekly). Saturdays. Established 1902, 8 pages, $1.25, circulation 22,000. Amalgamated Associa tion of Street and Electric Railway Employes of Ameri ca, 332 South Ashland Boulevard, Chicago, Ill. L. D. Bland, ed. American Federation of Labor Weekly News. Uses mats."
American Vanguard,monthly,"The National Rip-Saw Publishing Co., Leesville, Louisiana, and Box 1128, Chicago, Ill. Kate Richards and Frank P. O'Hare, eds. Pro gressive politically.",The National Rip-Saw Publishing Co.,"Chicago, Ill.",41.7750332,-87.6964408,"Kate Richards, Frank P. O'Hare",General Labor (U.S.),"American Vanguard, The (monthly). Established 1904, 16 pages, $1, circulation 25,000. The National Rip-Saw Publishing Co., Leesville, Louisiana, and Box 1128, Chicago, Ill. Kate Richards and Frank P. O'Hare, eds. Pro gressive politically."
